{
  "title": "I'm Your Man",
  "content": {
    "content": {
      "text": [
        [
          "If you want a lover",
          "I'll do anything you ask me to",
          "And if you want another kind of love",
          "I'll wear a mask for you",
          "If you want a partner, take my hand, or",
          "If you want to strike me down in anger",
          "Here I stand",
          "I'm your man"
        ],
        [
          "If you want a boxer",
          "I will step into the ring for you",
          "And if you want a doctor",
          "I'll examine every inch of you",
          "If you want a driver, climb inside",
          "Or if you want to take me for a ride",
          "You know you can",
          "I'm your man"
        ],
        [
          "Ah, the moon's too bright",
          "The chain's too tight",
          "The beast won't go to sleep",
          "I've been running through these promises to you",
          "That I made and I could not keep",
          "Ah, but a man never got a woman back",
          "Not by begging on his knees",
          "Or I'd crawl to you baby and I'd fall at your feet",
          "And I'd howl at your beauty like a dog in heat",
          "And I'd claw at your heart, and I'd tear at your sheet",
          "I'd say please (please)",
          "I'm your man"
        ],
        [
          "And if you've got to sleep a moment on the road",
          "I will steer for you",
          "And if you want to work the street alone",
          "I'll disappear for you",
          "If you want a father for your child",
          "Or only want to walk with me a while across the sand",
          "I'm your man"
        ],
        [
          "If you want a lover",
          "I'll do anything you ask me to",
          "And if you want another kind of love",
          "I'll wear a mask for you"
        ]
      ]
    }
  },
  "kind": "song",
  "annotations": [
    {
      "anchor": "p1.l1",
      "tokens": [
        {
          "kind": "docref",
          "docRef": "symbol.lover"
        }
      ],
      "user": "sudonhim"
    },
    {
      "anchor": "p1.l8",
      "tokens": [
        {
          "kind": "docref",
          "docRef": "symbol.man"
        }
      ],
      "user": "sudonhim"
    },
    {
      "anchor": "p2.l3",
      "tokens": [
        {
          "kind": "docref",
          "docRef": "symbol.doctor"
        }
      ],
      "user": "sudonhim"
    },
    {
      "anchor": "p2.l8",
      "tokens": [
        {
          "kind": "docref",
          "docRef": "symbol.man"
        }
      ],
      "user": "sudonhim"
    },
    {
      "anchor": "p3.l1",
      "tokens": [
        {
          "kind": "docref",
          "docRef": "symbol.moon"
        }
      ],
      "user": "sudonhim"
    },
    {
      "anchor": "p3.l3",
      "tokens": [
        {
          "kind": "docref",
          "docRef": "symbol.sleep"
        }
      ],
      "user": "sudonhim"
    },
    {
      "anchor": "p3.l6",
      "tokens": [
        {
          "kind": "docref",
          "docRef": "symbol.man"
        }
      ],
      "user": "sudonhim"
    },
    {
      "anchor": "p3.l6",
      "tokens": [
        {
          "kind": "docref",
          "docRef": "symbol.woman"
        }
      ],
      "user": "sudonhim"
    },
    {
      "anchor": "p3.l10",
      "tokens": [
        {
          "kind": "docref",
          "docRef": "symbol.heart"
        }
      ],
      "user": "sudonhim"
    },
    {
      "anchor": "p3.l12",
      "tokens": [
        {
          "kind": "docref",
          "docRef": "symbol.man"
        }
      ],
      "user": "sudonhim"
    },
    {
      "anchor": "p4.l1",
      "tokens": [
        {
          "kind": "docref",
          "docRef": "symbol.road"
        }
      ],
      "user": "sudonhim"
    },
    {
      "anchor": "p4.l1",
      "tokens": [
        {
          "kind": "docref",
          "docRef": "symbol.sleep"
        }
      ],
      "user": "sudonhim"
    },
    {
      "anchor": "p4.l5",
      "tokens": [
        {
          "kind": "docref",
          "docRef": "symbol.father"
        }
      ],
      "user": "sudonhim"
    },
    {
      "anchor": "p4.l7",
      "tokens": [
        {
          "kind": "docref",
          "docRef": "symbol.man"
        }
      ],
      "user": "sudonhim"
    },
    {
      "anchor": "p5.l1",
      "tokens": [
        {
          "kind": "docref",
          "docRef": "symbol.lover"
        }
      ],
      "user": "sudonhim"
    }
  ]
}