{
  "title": "True Love Leaves No Traces",
  "content": {
    "content": {
      "text": [
        [
          "As the mist leaves no scar ",
          "On the dark green hill ",
          "So my body leaves no scar ",
          "On you and never will ",
          "Through windows in the dark ",
          "The children come, the children go ",
          "Like arrows with no targets ",
          "Like shackles made of snow "
        ],
        [
          "True love leaves no traces ",
          "If you and I are one ",
          "It's lost in our embraces ",
          "Like stars against the sun "
        ],
        [
          "As a falling leaf may rest ",
          "A moment on the air ",
          "So your head upon my breast ",
          "So my hand upon your hair "
        ],
        [
          "And many nights endure ",
          "Without a moon or star ",
          "So we will endure ",
          "When one is gone and far "
        ],
        [
          "True love leaves no traces ",
          "If you and I are one ",
          "It's lost in our embraces ",
          "Like stars against the sun"
        ]
      ]
    }
  },
  "kind": "song",
  "annotations": [
    {
      "anchor": "p0.l1",
      "tokens": [
        {
          "kind": "docref",
          "docRef": "symbol.green"
        }
      ]
    },
    {
      "anchor": "p0.l1",
      "tokens": [
        {
          "kind": "docref",
          "docRef": "symbol.dark"
        }
      ]
    },
    {
      "anchor": "p0.l4",
      "tokens": [
        {
          "kind": "docref",
          "docRef": "symbol.window"
        }
      ]
    },
    {
      "anchor": "p0.l4",
      "tokens": [
        {
          "kind": "docref",
          "docRef": "symbol.dark"
        }
      ]
    },
    {
      "anchor": "p0.l7",
      "tokens": [
        {
          "kind": "docref",
          "docRef": "symbol.snow"
        }
      ]
    },
    {
      "anchor": "p1.l3",
      "tokens": [
        {
          "kind": "docref",
          "docRef": "symbol.sun"
        }
      ]
    },
    {
      "anchor": "p1.l3",
      "tokens": [
        {
          "kind": "docref",
          "docRef": "symbol.star"
        }
      ]
    },
    {
      "anchor": "p2.l3",
      "tokens": [
        {
          "kind": "docref",
          "docRef": "symbol.hair"
        }
      ]
    },
    {
      "anchor": "p3.l0",
      "tokens": [
        {
          "kind": "docref",
          "docRef": "symbol.night"
        }
      ]
    },
    {
      "anchor": "p3.l1",
      "tokens": [
        {
          "kind": "docref",
          "docRef": "symbol.moon"
        }
      ]
    },
    {
      "anchor": "p3.l1",
      "tokens": [
        {
          "kind": "docref",
          "docRef": "symbol.star"
        }
      ]
    },
    {
      "anchor": "p4.l3",
      "tokens": [
        {
          "kind": "docref",
          "docRef": "symbol.sun"
        }
      ]
    },
    {
      "anchor": "p4.l3",
      "tokens": [
        {
          "kind": "docref",
          "docRef": "symbol.star"
        }
      ]
    }
  ]
}