{
  "title": "Night Comes On",
  "content": {
    "content": {
      "text": [
        [
          "I went down to the place where I knew she lay waiting",
          "Under the marble and the snow",
          "I said, Mother I'm frightened, the thunder and the lightning",
          "I'll never come through this alone",
          "She said, I'll be with you, my shawl wrapped around you",
          "My hand on your head when you go",
          "And the night came on, it was very calm"
        ],
        [
          "I wanted the night to go on and on",
          "But she said, go back, go back to the world",
          "We were fighting in Egypt when they signed this agreement",
          "That nobody else had to die",
          "There was this terrible sound, my father went down",
          "With a terrible wound in his side",
          "He said, try to go on, take my books, take my gun",
          "Remember, my son, how they lied",
          "And the night comes on, it's very calm",
          "I'd like to pretend that my father was wrong",
          "But you don't want to lie, not to the young"
        ],
        [
          "We were locked in this kitchen, I took to religion",
          "And I wondered how long she would stay",
          "I needed so much to have nothing to touch",
          "I've always been greedy that way",
          "But my son and my daughter climbed out of the water",
          "Crying, Papa, you promised to play",
          "And they lead me away to the great surprise",
          "It's Papa, don't peek, Papa, cover your eyes",
          "And they hide, they hide in the world"
        ],
        [
          "Now I look for her always, I'm lost in this calling",
          "I'm tied to the threads of some prayer",
          "Saying when will she summon me, when will she come to me",
          "What must I do to prepare?",
          "When she bends to my longing like a willow, like a fountain",
          "She stands in the luminous air",
          "And the night comes on, it's very calm",
          "I lie in her arms and says when I'm gone",
          "I'll be yours, yours for a song"
        ],
        [
          "Now the crickets are singing, the vesper bells ringing",
          "The cat's curled asleep in his chair",
          "I'll go down to Bill's Bar, I can make it that far",
          "And I'll see if my friends are still there",
          "Yes, and here's to the few, who forgive what you do",
          "And the fewer who don't even care",
          "And the night comes on, it's very calm",
          "I want to cross over, I want to go home",
          "But she says, Go back, go back to the world"
        ]
      ]
    }
  },
  "kind": "song",
  "annotations": [
    {
      "anchor": "p1.l2",
      "tokens": [
        {
          "text": "The temple and the snow form a sort of binary - those whose spiritual attachments are elevated and affirmed in the public square are in the temple, those who are exiled from it must make their home in the snow. Here LC locates the nurturing mother figure as being beneath both.",
          "kind": "text"
        }
      ],
      "user": "sudonhim"
    },
    {
      "anchor": "p2.l1",
      "tokens": [
        {
          "text": "The night is a time of comfort but also of illusion, as we are shielded from the world. In daytime we wrestle with reality, often in struggle and suffering, but our vision is clearer.",
          "kind": "text"
        }
      ],
      "user": "sudonhim"
    },
    {
      "anchor": "p2.l3",
      "tokens": [
        {
          "text": "This is the ceasefire agreement signed in the Yom Kippur war, which didn't last the night.",
          "kind": "text"
        }
      ],
      "user": "sudonhim"
    },
    {
      "anchor": "p1.l2",
      "tokens": [
        {
          "kind": "docref",
          "docRef": "symbol.snow"
        }
      ],
      "user": "symbols bot"
    },
    {
      "anchor": "p1.l3",
      "tokens": [
        {
          "kind": "docref",
          "docRef": "symbol.mother"
        }
      ],
      "user": "symbols bot"
    },
    {
      "anchor": "p1.l7",
      "tokens": [
        {
          "kind": "docref",
          "docRef": "symbol.night"
        }
      ],
      "user": "symbols bot"
    },
    {
      "anchor": "p2.l1",
      "tokens": [
        {
          "kind": "docref",
          "docRef": "symbol.night"
        }
      ],
      "user": "symbols bot"
    },
    {
      "anchor": "p2.l5",
      "tokens": [
        {
          "kind": "docref",
          "docRef": "symbol.father"
        }
      ],
      "user": "symbols bot"
    },
    {
      "anchor": "p2.l8",
      "tokens": [
        {
          "kind": "docref",
          "docRef": "symbol.son"
        }
      ],
      "user": "symbols bot"
    },
    {
      "anchor": "p2.l9",
      "tokens": [
        {
          "kind": "docref",
          "docRef": "symbol.night"
        }
      ],
      "user": "symbols bot"
    },
    {
      "anchor": "p2.l10",
      "tokens": [
        {
          "kind": "docref",
          "docRef": "symbol.father"
        }
      ],
      "user": "symbols bot"
    },
    {
      "anchor": "p3.l1",
      "tokens": [
        {
          "kind": "docref",
          "docRef": "symbol.kitchen"
        }
      ],
      "user": "symbols bot"
    },
    {
      "anchor": "p3.l5",
      "tokens": [
        {
          "kind": "docref",
          "docRef": "symbol.water"
        }
      ],
      "user": "symbols bot"
    },
    {
      "anchor": "p3.l5",
      "tokens": [
        {
          "kind": "docref",
          "docRef": "symbol.daughter"
        }
      ],
      "user": "symbols bot"
    },
    {
      "anchor": "p3.l5",
      "tokens": [
        {
          "kind": "docref",
          "docRef": "symbol.son"
        }
      ],
      "user": "symbols bot"
    },
    {
      "anchor": "p4.l7",
      "tokens": [
        {
          "kind": "docref",
          "docRef": "symbol.night"
        }
      ],
      "user": "symbols bot"
    },
    {
      "anchor": "p5.l7",
      "tokens": [
        {
          "kind": "docref",
          "docRef": "symbol.night"
        }
      ],
      "user": "symbols bot"
    }
  ]
}