{
  "title": "1974-09-18 - Birmingham",
  "metadata": {
    "date": "1974-09-18"
  },
  "content": {
    "content": [
      {
        "kind": "variation",
        "reference": "db/songs/songs_of_love_and_hate/joan_of_arc",
        "content": {
          "text": [
            "Modified Verses",
            [
              "Who are you ?, she sternly spoke",
              "To the voice beneath the smoke",
              " And saying this she climbed inside",
              "To be his one, to be his virgin bride"
            ]
          ]
        }
      },
      {
        "kind": "prologue",
        "reference": "db/songs/songs_from_a_room/seems_so_long_ago_nancy",
        "content": {
          "text": [
            "I'd like to sing a song for a most beautiful blonde woman who died in 1961, in Montreal."
          ]
        }
      }
    ]
  },
  "kind": "live"
}